<?xml version="1.0" encoding="UTF-8"?>
<xs:schema xmlns:xs="http://www.w3.org/2001/XMLSchema"
           targetNamespace="http://www.epam.com/bouquet"
           xmlns:tns="http://www.epam.com/bouquet"
           elementFormDefault="qualified"
           attributeFormDefault="unqualified">
  <xs:element name="bouquet" type="tns:bouquet"/>
  <xs:complexType name="bouquet">
    <xs:sequence>
      <xs:element name="id" type="tns:UUID" minOccurs="0" maxOccurs="unbounded"/>
      <xs:element name="name" type="xs:string"/>
      <xs:element name="flower" minOccurs="1" maxOccurs="unbounded">
      <xs:complexType>
        <xs:all>
          <xs:element name="id" type="tns:UUID"/>
          <xs:element name="name" type="xs:string"/>
          <xs:element name="price" type="xs:double"/>
          <xs:element name="cutDate" type="xs:date"/>
          <xs:element name="stemLength" type="xs:double"/>
          <xs:element name="color" type="xs:string"/>
        </xs:all>
      </xs:complexType>
      </xs:element>
    </xs:sequence>
  </xs:complexType>
  <xs:simpleType name="UUID">
    <xs:restriction base="xs:string">
      <xs:pattern value="[0-9a-fA-F]{8}-[0-9a-fA-F]{4}-[0-9a-fA-F]{4}-[0-9a-fA-F]{4}-[0-9a-fA-F]{12}"/>
    </xs:restriction>
  </xs:simpleType>
</xs:schema>